<?xml version="1.0" encoding="UTF-8"?>
<!DOCTYPE root SYSTEM "D:\dtds\root.dtd">
<root>
	<root1>
    </root1>
	<root2>
		<root3>
			<root1>
		</root1>
		</root3>
	</root2>
	<root1>
		<root2>
			<root3/>
		</root2>
		<root2>
			<root3>
				<root1>
					<root2>
						<root3/>
					</root2>
				</root1>
			</root3>
		</root2>
	</root1>
</root>
